msj_ort;TAG
la previa lluvia anunciada finalmente llego ciudad  fotos desde nuestra ciudad  oro verde santa fe enviada nuestros fieles seguidores  fotos mauricio caminos  diego beron   alejandra veloz cris vy ;1
solo  nos agarra lluvia ;1
 pero claro igual lluvia decia pelo todas esas cosas ;0
y ojala lluvia ahogue entre brazos  no volverte ver  ni sueños   ;0
 estan mostrando tragedia rayo  cronista martin debajo mismo arbol  lloviendo  pero buscan  muerte vivo ahora defensa civil hizo correr  mariana produccion piensan descerebrados ;0
hoy lluvia no permite estar plaza pero podes adoptarme igual   \U0001f600  \U0001f4de telefono          pato         \U0001f4bb traves formulario web    \U0001f460 minici calzados    julio       \U0001f4f1   locales   uno independencia       ;0
que lluvia orto ;1
lluvia no tenemos miedo  enzo ceres prometo hacemos frente con tremendas canciones  cancion tenes ganas escuchar  dejalo aca  leemos   ;0
la lluvia salle llora porque cola promo ;0
se largar tormenta concha lora yo esperando colectivo  suerte lado  ;1
si hay algo cambia humor bien escuchar truenos mientras estoy acostada  hermosura  \U0001f60d \U0001f499 ;0
si antes estaba mal bronceada no quiero imaginar ahora tuve pechar moto hasta estacion servicio rayo sol  odio ;1
no quiero ser mala onda  pero dan lluvia mañana  \U0001f926 \U0001f3fb \u200d \u2642   ;1
se largo lluvia con todo  como llego departamento  \U0001f632 ;1
 tormentas muy pasajeras  rapida formacion  desplazamiento disolucion  ;0
hace mucho no veia tormenta estas che ;1
lpm bronca saber hay gente animales calle con tormenta viene   ;1
buen domingo    despues tormenta todo tili trabajando volver normalidad   orgullosa pueblo    \U0001f60d ;1
mi hermana preparando desayuno con razon lluvia  \U0001f625 ;0
linda lluvia dormir con  \u2764  ;0
con lluvia dormir con   ;1
la gente dice  ay toda vida vida sin ir colectividades cuando quiero ir llueve  mira esa justo atraccion principal evento amigue tiene maldicion gitana llueve siempre no porque decidiste ir ;0
se viene otra tormenta lindo  ;1
y si venis dormir conmigo con lluvia    enviar ;0
colectivo inundado cucarachas  asco dan ;0
se acuerdan año pasado llovia todos mis francos  bueno  estaba organizando ir semana viene rio llueve  ;0
al gusta lluvia tiene auto tiene todo dia peso  si no no explica ;0
la lluvia espejo ayuda verte bien ;0
mierda tienen rayos ojos  ;0
no paro escuchar tema trueno  alto tema rain ;0
 paula hermosa lluvia  caso cerrado  ;0
lluvia arcoiris  mendiolaza  ;1
el ruido olor lluvia \U0001f60d \U0001f60d \U0001f60d ;1
bueno hasta tormenta boludea ;0
la tormenta sabado arruino todo esa si era caracha   ;1
fuerte tormenta con rafagas viento azoto localidades miramar marull  tomamos contacto con intendentes municipales  caidas arboles  postes luz no hay heridos ni evacuados  gobierno desarrollo social defensa civil evaluan daños dar rapida respuesta  ;1
 pero con lluvia vas marear con arena movediza ;0
lluvia hermosa  \U0001f60d \U0001f60d ;1
cuando yo era chica habia tormenta electrica usaba habia apagar desenchufar tv no quemara caso rayo corte luz tension  ;0
se largo lluvia aca parana ;1
andar moto con lluvia mejor  pero agarre lluvia torrencial moto ;0
te vi bariloche  no encare respeto novia pero no podes seer asi linda casarte tan joven  rayos  \u2014 si igual hubiera dejado cara     ;0
rayos despues pregunto porque estoy solo ;0
largar tormenta electrica tan fuerte hasta tiembla puerta ;1
 rayos  tienes razon ;0
amo dormir con lluvia  \u2764 ;0
mira hermoso llueve yo sin faltas  \U0001f623 quiero ;1
no voy tolerar con fresquito lluvia tenga dormir siesta solo ;1
  si       llueve fresquito  buscame alguna guardia porque seguro internaron ataque risa  ;0
llego tormenta di cuenta quede sin puchos   \U0001f926 \u200d \u2642  ;1
amo olor lluvia verano ;0
con tormenta dan ganas estar con viendo pelicula  ;1
que buena noche con tormenta  lluvia todo ;1
tramitame esa tal tormenta ;0
no tengo drama  pero dejas lluvia  ;0
 buen lunes  lluvia  aire libre  disfrutar  dias lluvia  protege tus electronicos       waterproof  no corras riesgos con imitaciones mala calidad     ;0
como llueve culiada ;1
desde temprano estoy sola casa con lluvia  asi como gustaria estar todos dias   paz ;1
  no creo pibe    años aca rosario levante  tome   colectivos vaya trabajar con semejante inundacion   con temporal veo dificil pero capaz alguno vaya       añitos pocos tan responsables esa edad ;0
ahora informa policia caminera   corte total camino cuadrado  escasa visibilidad lluvia  ;1
lluvia hija puta  bronca  esperar tanto dia ahora esperar otros dias mas dios  ;1
tormenta mierda ;1
se viene tormenta nuevo lpm \U0001f629 ;1
quien anduvo lluvia tuve bañar   \U0001f644 \U0001f644 \U0001f926 \U0001f3fc \u200d \u2640  \U0001f926 \U0001f3fc \u200d \u2640   ;0
hola    che hago consulta        aca viedma         larga  avisame si voy con gomas lluvias lisas   tengo ganar ganar   \U0001f602 \U0001f602  ;0
no llueve tengo limpiar pileta pieza  tanto odia vida  tanto  ;1
que linda lluvia lpm \U0001f60d ;1
 mira voy acordar todo eso plena tormenta  mas vale muero listo ;0
que hermosura dormir escuchando fondo lluvia  \U0001f495 ;1
amo usar mis botas lluvia ;0
 como hay tormenta ir ahora  mañana   ;0
 nota estas modo abuela no salis   si llueve mandas helado cagarme salida  ;0
pocas veces siento tan adolescente como cuando llueve no tengo paraguas ;0
complicaciones provincia buenos aires lluvias variada intensidad  fue caso pehuajo donde ya registraron acumulados oficiales encima       atentos tiempo  smn  ;1
lluvia       parece ser     ayer    termica      ahi bien   \U0001f628 \U0001f628  ;1
que cosa hermosa dias asi cafe bien caliente ver lluvia desde ventana ;1
senti esos truenos  \U0001f634 \U0001f63b \U0001f63b ;1
dale lluvia hace tuyo ;1
el pronostico alertando tanto tormenta aca todavia no paso nada ;1
 posibilidad tormenta poco tiempo  ;0
ojala tormenta pase rapido  \U0001f64f ;1
y despues  tormenta   rayos  tormenta  noche  nikond      ;0
me pueden explicar porque tengo tanto miedo tormentas  necesito abrazar alguien  sad  ;0
amor eterno dias lluvia  \U0001f49a ;1
 mal waso  igual si puedo ir antes      voy  pero onda si ya no inundado  cosa no creo ;0
lluvia hacete presente ;0
segundo dia ciudad  pura lluvia  lpm  viento  yo con valija llena musculosas  sandalias  soleros shorcitos   \U0001f612 nunca buzo  siempre tan visionaria      cansada triunfar  \U0001f606   ;1
manejar con lluvia  \U0001f495 ;1
no dejas nadie diga hoy dia lluvia ;0
de truenos ;0
no vas  \u201c quemar \u201d mas grasa salir correr mediodía rayo sol con    grados  unico vas lograr deshidratarte  cagarte calor  dolor cabeza mas fatiga  no sean enfermos ;1
queres mirar lluvia estrellas   am terraza casa   mientras prendemos uno  enviar  ;0
nos agarro lluvia centro \U0001f605 ;1
otra tormenta cabeza hace no pueda parar pensar ;0
lluvia ;1
dormir con lluvia  \U0001f60d \U0001f486 \u200d \u2640  ;1
esta chequeado yo tengo ir rendir con lluvia  ;1
que hermosa lluvia dormir con    ;1
lluvia  \u2764  ;1
esta noche lluvia estrellas   ;0
esta llueve ;1
en       largate lluvia hija ;1
y lluvia     ;1
dia lluvia    dia ideal darte vuelta feria litoral    \U0001f327 \U0001f609 monton locales bajo techo puedas disfrutar paseo familia    mostramos algunas opciones juguetes vas poder encontrar mas peques    \U0001f600 ;1
me acaba decir hermana cuando llegue casa  hace llamar mama metio abajo lluvia helada porque estaba chupada   ;0
como rompe huevos porque ellos esten auto   pasen importe si mojan no   dia lluvia   pelotudos egoistas   ;1
lluvias tormentas inicio semana    ;1
hace   dias viene indicando lluvia pronostico celular  hasta lluvia nos robaron  hdp  asco humedad        ;1
al menos hasta enero mantendria tendencia con lluvias encima normal    ;1
los pueblos afectados lluvias malaga  sevilla cadiz  declarados zona emergencia  ;1
 llegue mas rapido rayo macqueen ;0
 argentina duerme espera cambio vamos buen camino  lluvias tormentas  hipocritas mentirosos vende patria  \U0001f621 \U0001f621 \U0001f621 \U0001f621 \U0001f621 ;0
esta cayendo pequeño granizo   traigan fernet ;1
me voy dormir con ruido lluvia ;1
loco manera sufrir ni quiero imaginar hinchas fueron hasta bombonera lluvia suspenda queres matar lluvia mierda ;1
hijos puta los dias lluvia  pasan auto rapido orilla mojan pobre pelotudo va pata  ;0
justo hoy tenia haber tormenta lpm ;1
si no llueve hoy quilombo va armar ;0
basta  ;0
sos amor vida honda tornado lastima nunca voy tener  \U0001f494 ;0
 genia idola crack  voy estar apuntado rayos lasers toda noche ;0
cosas lindas estar acostado escuchando como llueve ;1
hace    minutos facundo deberia estar casa todavia no llego  tormenta  acompañenme ver triste historia  ;1
perdon eh  pero si suspenden final epica  lluvia  tienen ir todos mierda  si hay algo hace bien futbol  no vea ni bosta agua    ;1
justo cuando tengo ir trabajar llueve con todo ip  \U0001f622 ;1
escuchaba ruido pero lluvia no daba cuenta era  poco mas explotaba pava ;1
no tiene sentido lluvia si no tenes nadie con quien conchear \U0001f923 ;1
hay algo mas lindo dormir con lluvia  ;0
 argentina   ballesteros  tambo derrumbado fuerte tormenta madrugada     ;1
 hola buen dia polaca   todo lindo menos  lluvia   dias van abrazo   sigo cuenta otra   \U0001f60e \U0001f602 \U0001f602 \U0001f602 \U0001f602 ;1
che lluvia  lpm ;0
 bueno ahora nublo capaz si hiciste danza lluvia ;1
que cosa bien truenos ;1
alguien ve america  ahi tienen todos pelotudos aman lluvia   porque viven lugar no sufren inundaciones  no pierden pocas cosas materiales tienen  no mueren ahogados como bebe   meses  no tienen dormir colchones mojados  abran ojos  ;0
un sabado esos tormenta hace especial  uno quiera dormir con piernas  \U0001f648 ;1
la tormenta hdp caga todo ;1
lluvia siesta  ;1
con lluvia dormir con vs ;1
domingo  lluvia  casa papel block  \u2764  \u2764  \u2764  \u2764  ;1
   charly  sabes tormenta cayo eucalipto rural mato dos nenes  politica miserias humanas  ;1
el viento ruge hay tormenta interior ;0
cuando veo relampago ilumina todo despues suena trueno despacito como alta decepcion yo queria truenaso ;1
demasiada lluvia gusto  \U0001f614 ;1
miren como llueve yo con mis amigas  \U0001f644 ;1
bueno  canso lluvia ;1
la lluvia desnuda enorme deuda social ciudad rosario con habitantes  urbanizacion barrios populares debe ser hoy prioridad  mientras tanto  ademas asistencia  necesitan centros evacuados situaciones mas graves    ;1
 meti pileta con tormenta electrica sigo vivo ;1
lo llueve culiado ;1
que buena lluvia loco ;1
lluvia mas lindo hay \U0001f60d ;0
a dios con esos rayos esos truenos estoy mas desmayada  llamen ;1
las tormentas temporales pero bendicion dios siempre ;0
me voy dormir temprano  antes pare lluvia  nada mas lindo dormir asi ;1
maestro     granizo destructivo aca no hubo  si tenemos sunchales burro peruso donde podes pasar hacerte       ;0
uh trueno estas mas fuerte patada allanamiento ;0
algun dia voy tener novio dormir juntos dias lluvia  pero paso vamos para voy quedar con mis amigas  ;0
 \U0001f326  rosario pronostico tiempo extendido fin semana previo fiesta año nuevo  \U0001f327  especialista meteorologia  \U0001f4fb  anticipa como estara tiempo proximos dias  ;1
 trueno continuo comienza lluvia    sudeste cordoba oordoñez viene sur  ;1
te salvaste no llegue mensaje sino agarraba tornado  ;0
son   am pronostico anticipa buenos aires cielo nublado con probabilidad lluvias aislada vientos con rafagas  tarde noche  cielo nublado con vientos  rotando e  min     max    buen martes ;1
ahorrense tweets sobre lluvia concha madres mogolicos mierda ;0
  yo estoy rosario  tormenta fue algo impresionante  supuesto bocas tormenta tapadas  socialismo garcha pero culpa gente mugrienta abandonada  fue casi sobrenatural  nunca vi tormenta con tanta violencia  ;1
ya no se si estar contento llueve refresca estar mal llueve no puede hacer  \U0001f926 \u200d \u2642  ;1
alguien quiere acompañar ver tormenta  unico con problemitas  ;0
linda tarde estar acostado mirando como llueve escuchando system of down ;1
que cosa hermosa dormir con lluvia  ;0
no hay lluvia pueda parar pasion    hoy mas nunca  abriendo coloso  newell  carajo   hoy juega newells  hoy hay que ganar rojo negro  newells \U0001f534 \u26ab  newells old boys  ;0
ricardo giacosa  desde  josefina   \u201cen va mes cayeron     lluvia zona  total      año  \u201d  ;1
lo unico hace dar cuenta estamos diciembre olor pasto cortados  clima demas cosas debo  igual gracias thor dios trueno ;0
me cayo rayo lado casi paro cardiaco ;1
que lindo como llueve  \U0001f60d ;1
que hermosura ruido truenos rayos unas ganas parta uno \u26c8 \U0001f60d ;0
mi vieja piensa estoy loco porque sali patio ver si esas casualidades veia lluvia estrellas  ustedes bien  ;0
 ahora marcos escajadillo  secretario proteccion civil provincial   situacion provincia intensas lluvias  noticiero central   ;1
queres venir ver lluvia estrellas con  helado   \U0001f4ab enviar \U0001f4ab ;0
todo bien con lluvia  pero no puedo salir casa estoy aburriendo  \U0001f612 ;1
hace toda semana espero tomar sol con karen  llueve  tengo mucho sueño nublado todo dia   \U0001f624 ;0
 agarra relampago canta cancion  puto trueno  voy coger \u270a \U0001f3fb ;0
y otra cosa mejor lluvia  ella  \U0001f415 \U0001f49c   ;0
con casi      merlo fue zona mas lluvias acumulo durante noviembre  mas informacion  \u27a1    ;1
bueno creo cayo rayo patio mas menos  ;1
no estes sola lluvia   \U0001f3b6 \U0001f3a7 ;0
perdi celular lluvia eso ir wacha esa ;0
el cielo cansado ya ver lluvia caer cada dia pasa uno mas parecido ayer no encuentro forma alguna olvidarte porque seguir amandote inevitable  ;0
que buena tormenta dormir toda ;1
adivinen quien va dormir terrible siesta con hermosa lluvia  si  yo  ;1
la lluvia nunca mas ;0
me cague calor toda mañana llego casa llueve  joda  ;1
jugadores rayo vallecano patada mas baja tiene ser altura cuello gracias ;0
seguro lluvia estrellas nublado aca como siempre ;0
hanna no tiene miedo bombas  solo enoja porque sufre otitis  cuando hay tormentas quiere salir afuera  pero no gusta mojarse   si  tengo perra mas contradictoria hay  ;0
un amigo invito tomar terere siesta  fui casa rayo sol loco estaba cara orto  termine tomando mates con mama hablando pedo hasta hace rato ;0
por favor tormenta no cortes luz \U0001f64f \U0001f3fb \U0001f64f \U0001f3fb ;1
 donaciones nuestros  ciudad san justo estan ayudando vecinos afectados lluvias  desde  vamos realizar campaña provincial donaciones familias afectadas distintas localidades nuestra provincia   ;0
odio tanto tormentas  \U0001f622 ;0
queria acampar mañana pero seguro llueve ;0
 bueno ahora ayuda año viene  haganlo noviembre asi no llueve porque hace varios años venimos con mal clima  ;0
ni lluvia detiene    felices    williammorris  ;0
a ver si lluvia deja dar tanta vuelta ;0
me puedo morir paz  ya vi lluvia estrellas ;0
hace minutos vecinos captaron traves fotografia mini tornado toco tierra inmediaciones aero club san francisco  fenomeno propiciado sistema baja presion forma nubes con base baja generan tipo embudos   \U0001f327 \U0001f4a8  ;0
mi cama lluvia solo  \u2764 ;1
hasta cuando lluvia calcada concha puta hermana ;1
que lindo domingo  mama paseando auto con chongo bajo lluvia yo comiendo papas mientras veo serie  \U0001f44d \U0001f3fe ;1
esta lluvia no estamos juntos ;1
con grupo ya organizamos cenar casa amiga ver lluvia juntos  ;0
la lluvia ve genial desde ventana ;1
todo bien amo lluvia pero hermano tengo piano hoy no querias llover no  hora mas tarde lpm ;1
hermosa lluvia vengas dormir conmigo \u2665 ;1
jueguen con lluvia caguense patadas  gracias ;1
casi   hora caminando rayo sol ;1
el verano ya palpita  despues semana con temporal lluvia viento  mal tiempo historia  ;0
estudiar con lluvia    \U0001f4af ;1
tremendo como dejo ciudad tornado   ;1
que lindo fue dormir con encima llueva \u2764  \U0001f60d  lastima tuvimos subir nina porque ataco con tormentas  ;1
si vas manejar con lluvia  tene cuenta estos consejos   ;0
bella lluvia ;1
capaz si espero   deja llover   venia tormenta electrica   ;1
que lindo terminar finde con lluvia ;1
los truenos thor llorando stan lee ah no ;0
la siembra tuvo importante avance semana pasada mantiene adelantada respecto año pasado  situacion cultivo regiones  pesar lluvias     ;0
que cosa linda dormir con aire acondicionado escuchando lluvia  faltaria venga leo ;1
escuchando lluvia fondo mientras admiro belleza perro ;1
   horas sin luz    corta cuando hace calor  frio  cuando llueve  cuando hay viento  hasta cuando  ;0
despues tormenta siempre llega calma  pero  despues ti no hay nada ;0
con lluvia estaria bueno tener compañia \U0001f327 \U0001f497 ;1
si no parte rayo parto yo \U0001f63b \U0001f60d \U0001f60d  \u2014 nono tranquila ya parte rayo  ;0
traje novia casa anoche di comer  toque agarro sueño cuando durmio sali tomar birra con mis amigos vereda  despues fueron quede dormir con ella porque no iba dejar ir con tormenta  mata ternura dormir con esa chica \u2764 ;0
porque nos hace tanto ole tormenta    ;0
hubo tornado cordoba         ;0
en trabajo gane voucher ir comer todavia no use  con lluvia mojo rompio todo  ustedes bien  ;0
dios trueno ese  \U0001f62d ;1
   tiraron granizo      ;0
la tormenta llega festival vengan  ;0
esa lluvia duro menos dura chongo ;1
que tormenta mierda  nos cago todo ;1
amo lluvia ;0
esta lluvia culiada no quiere entender ;1
no cabe mas felicidad alma  despues tormenta sale sol \U0001f495 ;0
amo dormir con lluvia   feliz ;1
daria fuera  despertarme madrugada con tormenta bien electrica  \u26a1 \u26a1 ;0
lluvia podrias aflojar  ya suficiente  ;1
hay pronostico tormenta viejo preparando costillar     \U0001f340 good luck daddy \U0001f340 ;0
me gustaria saber por que puta app clima dice hay tormentas electricas va llover cuando hay manso sol ;0
lindo viajar con tormenta  no lloren  \U0001f614 ;1
mi mama escucha trueno automaticamente grita desenchufen wifi ;0
   otro dia flashie lluvia estrellas faltaba como semana  ;0
que linda lluvia estrellas ;0
por ahora juega  campo juego drenando bien  problema seria tormenta electrica  ;1
con lluvia  mates   docena facturas  ;1
loli sigue joda  rayos ;0
gente sali correr despues   meses  mañana pronosticado lluvia con granizos terremotos fuertes ;0
cuando llueve casa todo automatico onda ya saben no salgan camas pongan baldes donde gotee sujeten bien ventanas no vuele techo perfecta organizacion ;0
a fondo  culpa barras  inundaciones  mapuches  grupos organizados tormenta sabanas  pollos anarcokirchneristas      van hacer renunciar ocampo   \U0001f914  se nota mucho   copa libertadores ;0
ninguna tormenta eterna ;0
pero puta madre lluvia orto   ;1
mañana llueve  hasta hizo masajes  \U0001f631 \U0001f631 \U0001f631  ;0
que pare tormenta loco concha madre ;1
trueno vs dani  pierde  injustamente descendido  sea batallon   plata ;0
magico siempre hora salir trabajar llueve  hdp  ;1
llega ser mentira lluvia estrellas cago tiros ;0
 cordoba  martes      \U0001f53b   \U0001f53a   \u26c8 toda jornada  tormentas aisladas  ;0
que humo primavera estamos teniendo  dias horribles   con viento frio lluvia  ponete pilas dale   ;0
traje todo patio ver tranquilo lluvia estrellas y nublo dejate hinchar bolas hermano siempre tengo tanto mal orto ;1
 \U0001f534 ahora   efectos lluvia  \U0001f327 norte ciudad  asi encuentra av peñaloza       ;1
 lluvia espera juguemos local aparecer sino no entiende  ;0
xq no partio rayo  ;0
me llego android pie  no he usado tanto aun  asi no si dar gracias pedir parta rayo  ;0
asi nogoya tras lluvias torrenciales  intendente rafael cavagna recorrio mañana paseo puentes  hay    evacuados mas    auto evacuados  mas imagenes   ;1
 todo dia lluvia  mas    mañana ;1
siesta con lluvia    \u2764  ;1
alta tormenta vieja ;1
   culo llueve   ;0
cada vez llueve van poner  noviembre rain    ;0
buen dia   alto porcentaje humedad  rosario   altísimo porcentaje titulos deporte  estadio  vengan con lluvia torrencial noticias deporte    ;0
que satisfactorio escuchar como llueve \U0001f60c \U0001f60c \U0001f486 \u200d \u2640  ;1
imaginate terror tengo tormentas vine dormir sillon living porque alumbra cara refusilo miedo ;0
yo jodi con lluvia ahora no llover  lindo  \U0001f60d \U0001f60d ;1
hoy arrancaba estudiar eso lluvia no  ;1
no feliz con truenos ;0
lluvia dormir con bebe  ah  belgrano no perdio  no puedo pedir mas  feliz ;1
siguen alertas intensas lluvias gran parte pais hay victima fatal entre rios mantiene pronostico tormentas fuertes cordoba  san francisco lluvia acumula casi    desde ayer   ;0
dia lluvia   dia carbohidratos ;0
que lindo lluvia \u2764  ;0
pobrecito tirando estados tormenta cuantos años tenes      ;0
metete orto lluvia estrellas  todo nublado   ;1
que lindo despertarse ver llueve copado  \U0001f60d ;1
 todos no año pasado sequia  año  inundacion  mas excusas macri justifique inoperancia  saludo chicas  nona  ;0
no duro nada tormenta ;1
chiquita tormenta  \U0001f631 ;1
me iba trabajar agarro lluvia hermosa santa fe  cosa esto ser pobre trabajar  \U0001f623 ;1
se viene alta tormenta weys ;1
impresionantes imagenes tormenta anoche basabilvaso  departamento uruguay  entre rios  basavilbaso  ;1
esta lluvia relaja  ;1
no hermano mal estoy pasando con estos truenos ;1
hasta cuando con lluvia ;1
es cierto no pueden vincular veranos calor extremo grandes tormentas directamente cambio climatico  fenomeno lleva decadas manifestarse aumento temperatura promedio global  no picos puntuales  pero hasta ahi  ;0
calor  humedad  lluvia  pero alto cumple wuacho ;1
lluvia amo todo pero aguanta mañana quiero trabajar \U0001f926 \U0001f3fd \u200d \u2642 ;0
despues tormenta anoche  newbells consagro campeon torneo drenajes  ;1
no voy pegar ojo toda noche maldita tormenta ;1
que lindo debe ser dormir cucharita con tormenta    lastima estoy mas sola schoklender dia madre  ;1
veniamos andando bici contra viento entro granizo lluvia ojos feo  ;1
lluvia puta odio ;1
 llenada con propias lluvias  ;0
si  ya escuchaste tormenta ;1
que linda lluvia escribe con g con j ;0
la lluvia  truenos hacen querer estar con alguien  tonta ;0
diciembre fue mas lluvia mes ;0
anoche bailamos medio ruta cuando nos dejo joder lluvia  \U0001f602 \U0001f602 \U0001f602  ;0
tanto miedo voy tener tormentas    ;0
lo dormir con lluvia ;1
   yo rayo sol con jeans ya tengo heridos  ;1
alguien amable nos busque  nos agarro ka lluvia con machi  tenemos joda  ;1
soy unica ama sentarse ver tormentas  posta amo  \U0001f60d \U0001f329 ;0
un herido dejo tormenta afecto san javier   ;0
terrible tormenta seguir durmiendo ;1
inventaron lluvia arruinarme quincena ;0
calor  sol nada lluvias  pronostico tiempo nochebuena navidad   ;0
a largo cuando gorda queria ir comprar helado  pero saben  no hay lluvia calme voy igual  ;1
compartimos datos tiempo   \U0001f327 \u2601 \u26c5  datos tiempo  tiempo  lluvia  buen lunes  buena semana  gualeguay  ;0
lluvia espero con todas ansias       ;0
que ganas acampar  lastima lluvia ;1
   ponia ruido lluvia   ;0
sufro calor orto ahora llueve como concha lora  no queria mojarme     ;1
en aire buen dia  pone radio nubosidad variable  probabilidad lluvias tormentas aisladas  algunas localmente intensas  mejorando temporariamente  vientos regulares fuertes sector sur con rafagas  min     max   informacion sin ruido ;1
olor lluvia  \U0001f60d ;0
me parecio escuche trueno  ;1
yo no puedo creer mala leche tengo  voy inscribir curso  tome colectivo equivocado  baje casi rio medio lluvia busque otro colectivo tomarme medio barro  tuve cruzar toda ciudad no llegaba  ;0
linda lluvia dormir otras cosas mas ;1
caminar con lluvia escuchando betrayed debe ser mismo suicidarse creo ;0
fumando porro escuchando redondos viendo lluvia ;1
sandra todavia llueve ;1
tendria largarse hermosa lluvia asi noche pone fresco especial todo ;0
ojala caiga rayo medio escuela prenda fuego asi no tenemos clases hasta dentro    años cuando hagan otra ;0
con tiempo aprendes bailar abajo lluvia vez estar esperando pase tormenta ;0
siempre odie tormenta ;0
mi gata mas chica sufre tormentas como nadie parte cora mil    ;0
 si no ahogan con lluvia primero  ;0
segunda noche consecutiva digo  mañana armo pileta  llueve ;1
lluvia hermosa vida \U0001f60d \U0001f60d ;1
y trabajar con esa lluvia  \U0001f62b ;0
me estan haciendo saltar rayos caen oro verde lpm ;0
un cagazo truenos relampagos  ;0
pasamos lluvias soles pero siempre juntos ;0
no querer levantarse con lluvia         como cuesta trabajar ultimo tramo año  \U0001f622 \U0001f613  necesito vacaciones ;1
quiero tener alguien con quien pasar estas noches tormenta  con mimos abrazos  \U0001f97a ;1
 lluvia  amp  escuadra heroico    ;0
la ventana abierta escuche lluvia  \U0001f60d ;1
llueve sobre mojado  lala ;0
escape paolucci racing honda tornado             romamotos  escape  exhaust  paolucci  competicion  racing  honda  tornado  hondatornado  xr    roma motos  ;0
para nosotros  lluvia   amiga     yo quiero  helados  yo quiero  confitados  yo quiero  via    ;0
que linda lluvia  \U0001f486 ;1
que maravilla leer con lluvia    \U0001f496 \U0001f496 ;0
llueve duermo sola  hago todo mal ;1
pero belleza lluvia  ;1
 porque no arreglan baldosas flojas dias lluvia dejan hacer pelotudeces   ;0
el agua lluvia baja primero mayo  ;1
llueve afuera libro sabe  ;1
que hermosos dias lluvia \u2614 ;0
que hermoso como llueve ;1
me desperte hora antes disfrutar lluvia ;0
 pasa tengo juntar con wacha ver lluvia estrellas ;0
que lindo estudiar con lluvia dijo nunca nadie ;0
 mejor  lluvia ayudara disimular mis lagrimas  ;0
ya no si salir con campera solo con remera      con clima cualquier rato llueve \U0001f602 ;0
que linda lluvia quedarse cama durmiendo todo dia ;1
soy unica tiene fobia truenos  ;0
llegue media hora tarde  rayos tiempo  ;0
