msj_ort;TAG
esta lloviendo ;1
quiero ir centro mañana pero seguro llueve  ;0
 si  llueve mucho     \U0001f612 ;1
 si llueve hago  \U0001f917 ;0
hasta cuando voy seguir teniendo miedo tormentas   \U0001f644 \U0001f623 ;0
 sea estacion sea   no hay plata  ahora llueve   cambia   tenes estudiar igual ;1
llueve no tengo internet   espera tremenda tarde ;1
que linda noche lluvia  \U0001f496 ;1
miercoles mucho calor  previo lluvias  ;1
me gusta cuando llueve porque parece estan fritando empanadas  pues gorda  \U0001f602 ;0
noviembre sin ti sentir lluvia dice llorando todo acabo  \U0001f3b5 ;0
con lluvia dieron ganas cucharear    \U0001f60f ;1
y largo lluvia  \u2614 \U0001f495 ;1
que hermosa tormenta ;1
 dan lluvia  ;0
aseguran hay stock suficiente bengalas combatir tormentas  ;0
aprobe final con    tome cervezas con amigos  estuve con novio  comi milanesa napolitana  bañe con agua hirviendo estoy dormirme sabanas limpias con lluvia fondo gato lado  siento mas realizada  ;1
llueve porque sebastian levanto simpatico \U0001f602 \U0001f602 ;1
 horrible todo  eso llueve asi ;0
mi padre dice ahora van tener poner jugar  yo mientras miro si forma tormenta no  \U0001f615 ;0
buena  pasaba clima  donde salio lluvia  ;1
que onda   llueve  sale sol  llueve  sale sol  tiempo mas loco yo  ;0
lo hermoso dias lluvia ;0
que vergüenza ver otros humanos bicicleta buscando refugio plena tormenta    poca alma bicicletera ;1
mi plan dormirme escuchando temas fasciolo con ruido lluvia fondo haciendo cucharita con gata ;0
como hace mambear lluvia ;1
estaria venga tormenta dure hasta mañana  ;0
 sin dudas usted gobernador querido mejor piloto tormentas     ;0
en santa fe llueve  ;1
adivinen quien mojo   gracias tormenta ;1
me gustado video       temporada     acerca tormenta    fortnite  battle royale   ;0
recien despierto siesta    con lluvia quien no duerme   igual hubiera estado mas piola si dormiamos siesta juntos  ;1
sos hermosa \U0001f60d  \u2014 abran paraguas lluvia datos  ;0
netflix   lluvia   perfeccion ;1
  ;1
me canso lluvia ;0
ojala pusiera mimosa    lluvia pone mas gorda  ;1
que hermosa lluvia \U0001f495 ;1
vieron cordoba hay gente estudiando tormentas  bueno  creo con hacian tesis ;0
no   pero yo amo dormir con lluvia man ;0
que lluvia pase largo  quiero salir manga forros ;1
se levanto tormenta rato otro ;1
salir patio escuchar truenos dolby surround      ;1
lea anuncian hasta    \  mas     lluvias entre rios fin año  advierten fenomenos meteorologicos alto impacto proximos dias       empezara lluvioso  mira informe especial provincia region   ;0
encima lindo andar bajo lluvia  \U0001f60d \U0001f60d \U0001f60d \U0001f60d feo calor departamento  \U0001f62d \U0001f62d \U0001f62d \U0001f62d ;0
uno placeres vida    dormir mientras llueve \U0001f49e ;1
hay dormir nomas dice lluvia ;1
  video otro tema  porque depende complejidad quiera darle archivo  si solo fotos si videos  mañana paso data porque estoy bajo tormenta lpm corta luz cada rato     ;0
 uno   cuando cacha   trueno  etc  estaban quinto toque ya estaban red bulls inter  bestia  ;0
que ganas hacer cucharita con wacho con lluvia ;1
ya sabemos llueve  manga forros ;1
re xxl lluvia ;1
venia gimnasio plena tormenta relajada  cruza hombre dice  corre vienen piedras  cai podia ser posible empece correr  ;0
por fin lluvia hdp ;1
tengo ganas salir bicicletear pero viendo fotos videos piedras lluvia dio miedo  culpa ;0
dormi lindo che  extrañaba lluvia   ;0
el miedo agarre tormentas noche  \U0001f613 ;0
vete aqui tormenta  ;1
y llego tan ansiada lluvia  \U0001f600 ;1
alguien escuchando esos truenos  ;1
se ve tormenta fue copada porque tiro arbol;0
a hora ir trabajar  llueve como locos camilo aldao  ;1
mi viejo cae rayo corta luz ;0
haganse favor salir mirar cielo  belleza  casi no ve lluvia estrellas  pero igual cielo lleno ;0
los dias lluvia \U0001f60d ;0
anoche desperte rayo primero pense fue oigan muchacho escucharon relampago    tengo mente matada ya ;0
se larga lluvia  fijar tweet  ;0
no lluvia no motiva nada estudiar  solo quiero dormir ;1
estamos epoca nos chupa huevo otro  donde solo nos importa cagarnos esfuerzo hacen  persona nos chupa huevo como sienta  si total  yo estoy bien  resto    parta rayo ;0
si llueve ya saben porque  estoy yendo colegio ;0
dato lluvia caida gualeguay    ;0
 deja lluvia tranquila vamos dormir siesta  \U0001f61d ;1
ta desmayarse con lluvia ;1
amo ver como estan canchas con lluvia admirable ver como con tanta lluvia algunos campos estan impecables ;0
como no cae rayo cabeza concha madre  ;0
 \U0001f327 imagen satelital mañana  muestra gran frente tormenta abarca sur santa fe  provincia entre rios noreste provincia buenos aires   \u2600 clima despejado resto zonas productoras           ;0
ya veo va largar llover cuando salga casa cuando volviendo  porque lluvia odia \U0001f926 \U0001f3fc ;0
que ganas estar con vida viendo peliculas mientras escuchando como llueve ;0
ay lluvia no quiere parar che  \U0001f649 ;1
que lluvia culiada ;0
un hermoso dia hoy  ay  bello dia hoy  desatar nuestra tormenta va tronar dolor  ;0
maldigo veredas hechas mierdas momentos lluvia  \U0001f620 \U0001f611 ;0
 estamos brasil  llueve con calor    grados sol mirandote asi  \U0001f31d ;0
para anduve ahora tengo ganas prenderla fuego tornado ;0
  seguro  tormenta electrica    ;0
lluvia calcada concha madre  \U0001f624 \U0001f62d ;1
pedido solidario afectados lluvias  ;0
 porque rato llega tormenta facha parana   ;0
quiero escuchar tormenta abrazada ;0
domingo lluvia bajon  arranque lunes media hora  ya fue todo  ;1
si lluvia llega hasta aqui  voy limitarme vivir ;0
tremenda tormenta madrugada ahora sol parte tierra  esto san luis ;0
tendria estar yendo buscar ropa primo pero estoy caminando bajo lluvia   ;1
trueno      fast furious   ;0
si puede jugar  hubo ya final con lluvia esa cancha  dudas recuerdo quien fue campeon    final copa libertadores  boca river  conmebol libertadores   estudio futbol    ;0
si llueve ahora menos espero mañana nublado  no aguanto calor \U0001f612 ;0
   frio \U0001f60a lluvia \U0001f496 azul \U0001f631 celular \U0001f917 solteras \U0001f602   mtvemabiggestfansbts ;0
aerolineas lluvia  segun san idiota  confirmado   jacques cousteau era campora  ;0
queria ir pileta  llueve  empece ver serie  corta luz ;0
  ultimamente lluvia ni tiempo nada larga con todo nomas ;0
quiero alguien pasar dias lluvia ;0
chica tormenta ;0
lluvia vida amo con todo corazon  gracias mundo ;1
que linda lluvia \U0001f60d ;1
  encima llueve balde  ;0
lo unico voy ver   mañana tormenta viniendo ;0
de nuevo lloviendo  siempre arruinando mis planes lluvia mierda ;1
rayos  \U0001f614 ;0
en vida real tengo miedo truenos  asi estoy    ;0
le puli rayos todo  bastante turra ;0
dormir con lluvia \u2665 maravilla ;1
llueve gano belgrano   \U0001f914 ;1
como loco si llueve ;1
llueve   baradel tigre asamblea suteba  espero tenga salir haciendo perrito rio     encima va tener bañar     \U0001f923 \U0001f923 \U0001f923 ;0
encima cuando quiero llueva temporada escuela no llueve  alta leche mia \U0001f602 \U0001f494 ;0
las intensas lluvias generaron creciente casi siete metros rio san antonio agua ingresa con mucha fuerza cauce rios serranos  luego varios dias lluvia afectan region  recomienda acatar ordenes defensa civil  no intentar  \u2026  ;0
 hermoso dormir bajo lluvia enfermaba ;0
los truenos estan dando alto miedo caen cerca ;1
quien necesita chongo con clima  si tengo gato tiene miedo tormenta  entonces acuesta encima  \U0001f495 ;0
           gracias marina  dia especial  hay truenos lluvia tambien sol todo junto mismo tiempo  hermoso verdad   feliz atardecer noche todos ustedes     ;1
no dia lluvia si no pisas    baldosas flojas    ;0
 estoy esperando lluvia    ;0
me dan miedo tormentas mas cuando corta luz    ;0
vieron hay familias ponen contentas cuando gana copa equipo futbol  bueno  casa andan asi contentos cuando llueve  ;0
imagenes  despues intensas lluvias asi quedaron barrancas diamante      no dice diario      abandono proyecto estabilizacion barrancas  solo ejecuto zona puerto ultramar  ;1
llueve poco ;1
verlo agustin anoche llegar mojado despeinado lluvia hizo cayeran babas \U0001f63b ;1
     cuando amanecia dia despues lluvia ;0
mirar cielo con insistencia suficiente primer rayo gran tormenta impacte tus ojos  ;0
lluvia hasta cuando \U0001f621 ;1
no hay como mirar futbol cuando llueve estando casa  \U0001f4a7 \u2601 \U0001f3e1 \U0001f44c \u26bd ;1
que hermosa tormenta     ;1
esa lluvia para dormir  \u2764 ;0
 \u26a0  ojo   avisa   \u201c luis severa tormenta con granizo     mts altura sobre ruta   atencion puede llegar ciudad hacer daño si sigue asi \u201d ;0
 dormi mal amiga flashie lluvia ;0
encima llueve estoy pata  embole maxima expresion ;1
desenchufen abuelo hay tormenta  ;1
esta lluvia ideal cenar unos fideo con salsa  ;1
como llueve  orgasmo escuchar sentir esto  \U0001f60d ;1
 esa calle traumo chica dia lluvia sorry ;0
me levante ir clases pum largo tormenta saludos desde cama  \U0001f44b ;1
la lluvia para cucharear ;0
real estoy entre mirar capitulo serie dormir  seguir pintando con lluvia \U0001f60d \U0001f60d \U0001f60d ;1
me agarro toda lluvia bici lpm ;0
hoy hace     años  tipo    años  habia sido expulsado secundaria haber hecho caricatura profesor  tuvo irse otro pais conseguir titulo  estaba haciendo unos experimentos cuando accidentalmente descubrio rayos   ;0
el olor lluvia  \U0001f60d ;0
 vas mojarte con lluvia  ;1
tengo rendir final todo inundado  suerte manejo regalo  \U0001f612 ;1
con lluvia tendria estar durmiendo  pero estoy particular ;1
se ve algunos accionistas tambien comieron viaje lluvia inversiones  mejor equipo    años  como no vamos controlamos inflacion  etc   problema gran parte nuestra deuda dolares  moneda maneja gran titiritero   ;0
  avion va arriba tormenta  no asustes   \U0001f60a \U0001f917 ;0
 superliga  patronato ruda bajo agua  mismas estuvieron empate  union    abril  hoy estan bajo lluvia ingreso vestuario patron    ;0
no trabajo llueve  trabajo hay sol espectacular ir pile  bien vida   ;0
lluvia mates  con mejor compañia  \U0001f475 \U0001f493 ;0
cuando voy madurar dejar tenerle miedo tormentas  hola insomnio  \U0001f44b ;0
que linda lluvia  estoy esperando parta rayo ;1
hernan hablo hacer algo como amo amigo hable sabados para activarmelos  pero llueve bocha  \U0001f926 ;1
tremenda lluvia estar acostada pero no   estoy espero no quedarme libre ;1
lluvia orto ;1
que lluvia hdp ;1
linda lluvia  viene chanta canchitas  \U0001f60c ;1
vamos hoy llueve \U0001f64f  ;1
que tormenta orto con necesidad;1
no llueve todo finde   cuando va llover  justo año nuevo;0
queria lluvia ahi tenes ;1
que pasa salen con lluvia     yo no puedo ni salir cama todavia ;0
ayer entere rayos salen tierra  nadie dijo  ;0
a novio haces feliz con tan poco    hoy hice tuco salio muy rico  muy modesta pero verdad  dijo    veces estaba riquisimo gracias hacer comida tan rica dia lluvia  amo ;0
 reprogramacion  taburetes  arte      \u2757 \u2757por pronostico lluvias  subasta taburetes politecnico reprogramada proximo lunes        \u2757  \u2757  ;0
se salio corazon pecho con trueno ;0
me estoy dando cuenta lluvia va fallar asi voy poner estudiar  ;0
me iba quejar tenia volver caminando con lluvia pero acorde sabado corrimos con bobos   cuadras con tormenta electrica  calles inundadas con viento frio paso ;0
los voy poner contexto  hermano salio  am  lluvia   sujeto  individuo cuando sale toma cantidades muy bajas alcohol  pero siempre puede haber excepcion  noche fue    ;0
ola bebe estas invitado casa no hacer nada  solamente acostarnos  darnos muchos besos escuchar como llueve enviar ;1
no inverno   cocino comio chocolate entero   resultado   dos dias lluvia granizo  ;0
otro inconveniente intensa lluvia  basura problema todos    interes general ;1
 boluda fue todo muy chistoso porque dije  \u201c lluvia oyes  escuchas  \u201d boludeando justo largo ;0
 esto verdadera vergüenza señora intendente    hace años reclamo no pasa nada    hace con plata mis impuestos    laguna forma cada vez llueve calle silva entre reconquista e iberlucea  haga algo favor     ;0
 ;0
como odio clima asi cosa pone muy mal humor  porque no llueve durante semana concha madre ;0
hace dos semanas paso mal secando ropa  lluvia remil orto ;1
malabia santa maria   san justo  calles llenas agua luego tormenta   ;0
desde   mañana      probabilidad lluvia  todo dia lluvia  salis afuera sol raja tierra  meteorologico chupame huevo    ;0
mama mira como llueve quiero dormir ;1
  veritas  estaba preocupada lluvia olvide cumplia años lpm ;0
tremendo rayo  prendio alarma auto  \U0001f631 ;0
que paja dormir sola con estos truenos orto ;1
lluvia amo ;1
que abuso como llueve ;1
dormir cuchareando mientras llueve deberia ser maravillas mundo  ;0
 rayos ;0
hoy si no llueve pinte mas loca casa sola para  \U0001f60b ;0
 lluvia agua mas estrellas  ;1
juega si llueve fin año active joda casa ;0
ay no  \U0001f62d \U0001f62d juro estoy cagada hasta patas miedo tengo tormenta  \U0001f62d \U0001f62d \U0001f62d ;1
team rebellion racing  dialogo radio   lotterer termina preguntando tecnicos  apuntando    ademas insiste  no facil conducir bajo estas condiciones  \U0001f302 lluvia entender cockpit quieren decirme  \ \ lotterer piloto audi supercar   ;0
culiado primera vez iba salir año llueve ;1
se viene tormenta  sin luz  calor insoportable  mosquitos docenas  quiero morir  ;0
lluvia ;0
lluvia querida  \U0001f60d ;1
aunque yo oculte tras montaña encuentre campo lleno caña  no habra manera rayo luna vayas ;0
que linda lluvia solo falta compañia estariamos  \U0001f917 \u2665  ;1
 no puedo dormir solo con lluvia  \U0001f62a ;1
lluvia  si   mis oidos tienen orgasmo  \U0001f648 ;1
avisame si falla rayo ;0
que lindo dormir con chongo lluvia fondo  lastima falta chongo ;0
 lluvia pleno  buen dia ;1
 anoche amagaron mañana hasta recien tambien   pero suerte tenemos   pero llueve mucho    \U0001f610 ;1
llueve      ;0
esta anunciado lluvia toda semana llega llover sabado muero no se  \U0001f64d ;0
truenos mierda \U0001f644 ;1
lluvia metele nomas \U0001f60d \U0001f60d ;0
si llueve va ser siesta perfecta \U0001f64f ;0
se presta lluvia para dormir acompañada ;1
cosa hermosa tormentas  \U0001f60d ;0
seguro llueve ;0
dicen pobre uruguay  tormenta     pero          \u2935   ;0
que lindo dormir con lluvia  \u2764 ;1
que linda lluvia loco \U0001f60d \U0001f60d \U0001f60d ;1
ya no gustan mas dias nublados con lluvia depresion loco ;0
 ;1
lluvia jugar      ;0
me anote natacion  pedo siempre llueve cuando voy  petiton triunfando ;0
lo rapido organizaron mis amigas venir desayunar centro  ni tormenta paro  tormenta culpa ellas    ;0
cocinamos con ulises llueve  \U0001f926 ;1
buen futbol lluvia  \u26bd  ;0
  demostra no solo servis colgar tornado \U0001f602 ;0
y lluvia para cuando  ;0
antes odiaba dias lluvia  ahora amo con todo ser  lindo martes bebe   ;0
el pronostico mañana mañana lluvia  pero con suerte tengo seguro sale alto sol ;0
linda lluvia dormir abrazados yo sin ;1
 facha tornado lpm ;0
 ;1
toda semana sol raja tierra pero llega sabado hay todo llueve como concha hermana ;1
yendo consulta con lluvia deberian aprobarme solo no quedarme durmiendo ;1
   chino  mudo matias    ir volver caminando casa kempes ir ver belgrano contra rafaela lunes bajo lluvia        vs velez torneo transicion       ;1
 ojala cruce con alguien tenga tantas ganas soñar como yo  no mienta ni mienta  baile entre tormentas   ;0
 lluvia   ;0
buscando ganas volver parana con lluvia ;0
lluvia  \u2614  lluvia  \u2614 mas lluvia  \u2614 ;1
traigan paraguas algo lluvia tambien ;1
estoy acostada escuchando lluvia unicamente parece perfecto ;1
en otros paises  canales noticias tienen tambien   camaras contando como desarrolla tormenta  durante    minutos  ;0
la otra vez vine buenos aires frio cagarse noche sabado  domingo cancha cagado calor  ahora lluvia todo hoy posiblemente mañana tambien  nunca dia normal no   ;1
con lluvia estar   ;1
se copo lluvia ;1
hice esperar mama abajo rayo sol poder terminar descargar playlist pepo porque  prioridades ;0
ay lluvia  \U0001f63b ;1
lluvia con sol rosario  ;1
alguien dice cuando va llover    lluvia ya cansas ;0
amo dias lluvia  \u26c8  \U0001f60a  ;0
 nono    vino grito  leo  mujer dijo avise hora antes llegue tormenta  ya casilda  juntamos todo  nos fuimos    llegar empezo llover  mejor vecino  ;1
 con lluvia ;0
pequeño susto pegue con trueno \U0001f602 ;1
 rayos  prestas diccionario  ;0
que ser despreciable  todos dias lluvia pasa mismo ;0
me desperte con alta tormenta me enamore ;1
donde lluvia decian iba haber hoy     niego jugar con calor  \U0001f926 ;0
el clima rosario  mesa adentro     anuncian lluvias hasta   enero  via  ;0
belen perezlindo  encargada area comunicacion biblioteca popular parana  indico lunes mañana  llegar     ;0
yo veo ami perros asustados tormenta   baja tristeza perros mascotas estan calle \U0001f494 ;1
lo odio cordoba lluvia inundaciones mamita querida horrible ;0
 con lluvia viene vos decis ;0
ultimo dia  ultimo sabado  ultimo futbol  ultimo mate  ultimo terere  ahora todos mismo idiotas primer lluvia  primer dia  primer cago  no puedo ver mas esa idiotez    ;0
hola aca tabossi entre rios no llueve pero refocila muchisimo  anoche tronaba pero no paso nada hoy tuvimos sol pleno mucho calor  zona centro entre rios echo desastre mucha piedra ;1
buscando alguien ver lluvia estrellas ;0
 \U0001f6a8 violencia sin fin  mataron tres personas ultimas horas  \U0001f449 lluvia balas parece no acabar  victimas fatales hombre    años dos jovenes       años  todos murieron episodios distintos  \u27a1    ;0
recien capture momento justo rayo dejo sin luz barrio san martin cercanias  \U0001f631      rayo  tormenta     ;1
nunca vida habia visto tantos rayos asi gigantes  ;0
estoy mil podrido mojarme con lluvia  parece joda ;1
 sabra dios si lluvia bendita pal tiene techo  desgracia castigo cielo  pal desamparado   ;0
que feliz con domingo lluvia con guiso arroz \U0001f437 ;1
pero soledad con lluvia ;1
que cosa hermosa lluvia  hermosa tormentas frio  dios no puedo ser mas fan    porque no tiempo  mimo alma dormir con sonido tormenta fondo  ;0
 granizo localidad maria juana  dio dia sabado tarde    ;1
si no llueve tengo salir  no queda otra ;0
amo lluvia ;0
 mas lindo mundo lluvia  no decis ;0
con lluvia todo nosotros viajamos igual  \U0001f917 ;0
fui gimnasio estoy yendo voley  si viene tormenta electrica ya saben porque ;0
y lluvia  ;0
lluvia ya odio ;0
quien puede asegurar no llueve  porque donde meto entrada caliope ;0
y sera unico arrecha lluvia   o ;0
te amo lluvia ;0
 cordi con lluvia ;0
tremenda lluvia  viento   culiada  nada voy che ;1
ah  pero con infinity war  lluvia spoilers   ;0
  ojo tambien con tormentas    ;0
con cantidad lluvia pronosticado proximos diez dias  como atreven organizar pool partys  ;0
con lluvia estaria necesitando ahora conmigo acostados abrazados decirte cuanto extraño   ;1
esta lluvia presta estar con ;1
como amo lluvia \U0001f60d ;0
necesito helado con lluvia ;1
 tobillera     recibira descargas rayos si hay alguna tormenta electrica   \U0001f914 ;0
 aparentemente querian vender europa  no mal  pero pronostico sabian  quizas estadios deberian estar mejores condiciones  aunque si llueve mucho poco tiempo  no hay cesped aguante  ojala pueda jugar  sino vuelven infumables todos  ;0
la lluvia mate llevan muy bien  \U0001f327 \U0001f60b \u2614   buen lunes  descubri tu lugar  ;1
deberia ser ilegal ir cursar con lluvia ;1
muy linda lluvia    hermosa gusto  pero chance hay frene toque hasta vuelva trabajar   \U0001f9d0 \U0001f914 ;1
la concha yuta  porque mierda anda tan mal cablevision cuando hay tormenta ;1
senti como llueve yo no puedo dormir ;1
semejante tormenta no refresque carajo  \U0001f611 ;1
la tormenta era mas linda estando casa con mama ;1
no soporto llueva odio lluvia parece bajoneara mas ;0
 lluvia ruedas ;0
me estoy yendo trabajar larga lluvia con todo  \U0001f629 hermosa suerte mia  \U0001f647 \U0001f3fd ;1
  con lluvia sabes como va estar mañana    tenemos salir si si ;1
escucha como llueve amigo  unas ganas morsear   culiada ;1
lo mas lindo dia  irme dormir con sonido lluvia ;1
no puede largar llover ahora puta madree  tengo cruzar pueblo bici llueve fuerte \U0001f62d ;1
dia lluvia laburamos asi     ;1
esta lluvia  favor  necesito estar todo dia cama ;1
estoy sentada tranquila balcon viendo rayos con pajaritos cantando fondo parece perfecto ;1
ya intentamos todo durante año largo  tormentas soledad con dolor ;0
el dilema ir gimnasio con lluvia  \U0001f327  ;1
buen dia  mañana comienza con cielo despejado \u2600  despues varios dias lluvia  temperatura actual        \U0001f321   ponete  al dia con variedad calidad noticias auspiciadas   ;1
lluvia hija mil puta ;0
re piola lluvia   \U0001f60d \U0001f602 ;0
que lluvia no corte noche ;1
que lluvia no detenga   salio hermoso entrenamiento   felicitaciones guapos   seguimos                llueva truene   ;0
  parecia era asi cuando salimos llorar pedo con tormenta cana atras  ;0
 mas alla eso  creo problema empieza ahora  subio napa  partir ahora cualquier lluvia moderada complica  ;0
la lluvia  birra mis amigos  \U0001f496 \U0001f496 ;1
quien manda volverme plena lluvia ;1
que linda lluvia despues tanto calor ;1
si dormir escuchando lluvia hermoso imaginate con lado \U0001f615 \U0001f60d \U0001f62d ;0
no escuche ni lluvia  \U0001f605 ;0
                      gracias querida lili     lluvia bendiciones      abrazos \U0001f618 \U0001f495 \U0001f378 \U0001f378 ;0
llueve   esta lindo estar con  ;1
todos mis hermanas van salir hoy \U0001f62a ver si medio noche parte rayo  gracias  ;0
ya espantaron lluvia con estupideces manga mogolicos ;0
amo como llueve  \U0001f60d \U0001f60d ;1
un dia lindo pero otro llueve despues vuelve estar lindo pero ahora vuelve llover ;1
lluvia estudio no van mano ;0
que linda noche lluvia dormir con   pongo   realidad no tengo ningun   pero queda piola decirlo ;0
hoy estaba ideal tomar sol dormi siesta  acabo ver clima dan lluvia hasta semana viene  \U0001f644 ;0
mirame siempre asi con esos ojitos hermosos tenes  moje no fue con lluvia no ;0
pu chito  balcon lluvia atr ;1
que lindo dormir con lluvia  \U0001f60d ;0
existe algo mejor lluvia  respuesta no ;0
hizo cuadro lluvia ;0
 tormenta  \u26c8  rosario   otra jornada sin  colectividades     lluvia      ;0
queres venir no dormir con lluvia  enviar ;1
esta lluvia ciega cristales alegrara perdidos arrabales negras uvas parra cierto patio ya no existe  mojada tarde trae voz  voz deseada  padre vuelve no muerto     borges  \U0001f495 \U0001f495  ;0
llueve como puta madre pero tomo campari igual ;1
zarpada lluvia anoche    ;1
llueve tengo fiebre no estoy cama  estoy sufriendo ;1
mabel tormenta viene  \U0001f62d \u274c ya veo sin dormir noche  \u274c ;0
truenos mierda \U0001f616 ;1
chiquito rayo  gr   lt  ;1
con lluvia jugo igual  resultado  mismo siempre domicilio encima  \U0001f449 \U0001f44c  ;0
 \U0001f389 \U0001f389 fiesta centro cultural parque españa   \U0001f389 \U0001f389  \U0001f388 veinticinco años desde chispa fundacional  musica vivo   visuales   gastronomia española   domingo         entrada con consumicion       caso lluvia  reprograma lunes     ;0
en serio hay personas asi  ojala nunca pase  no das idea mal estan pasando todas esas personas  raro con tanta lluvia no llegado agua tanque  ;0
lluvia  chiquero  con     como sea  donde sea     papa   ;0
mañana queria empezar correr  lluvia mierda ;0
un dia soleado hace calor insoportable otro hace frio llueve  loco clima \u2600  \U0001f321 \U0001f327 ;0
  siempre llovia mis francos  ahora ya no trabajo llueve cuando tengo salir vida odia ;0
si viene tormenta algo mas fuerte  yo puse estudiar ;0
la lluvia  \U0001f60d ;0
 aguanta mala  si llueve mojan todos no  ;0
tambien solicitaron solucion urgente con desagüe plaza bioquimico alrededores  dado rompio  puente  ellos habian hecho e ingreso agua viviendas ubicadas sobre canal maestro sur  tras ultimas lluvias   ;0
ya estariamos con lluvia eh   ;1
lave moto recibi millones mensajes mis  diciendome convoco lluvia   pero si  seguramente llueve  esa suerte  ;0
 estas con tus musas    yo estoy con mias pero lluvia no deja concentrar     ;0
que lindo dormir con lluvia  falta  ;1
 \U0001f327 \u26c8  hermoso haberme dormido escuchando lluvia  despierto sigue lluvia   \u2764 \u2764amo \u2764 \u2764 alguna duda no voy salir casa   \u2614 \U0001f302 ;1
nada mas feo ir caminando centro con tormenta auto bañe completo agua  ;0
 yo doy abrazo oso  noche  si no llueve  ;0
mejor no pongo estan lindas noches lluvia  \U0001f602 ;0
y lluvia  candela   ;0
como explico mucho dan miedo tormentas estoy durmiendo sola porque mama no quiere venir conmigo ;0
dios  lluvia hora dormir unas sietes maravillas mundo  \U0001f60d \U0001f60d \U0001f60d \U0001f60d \U0001f60d \U0001f60d \U0001f60d ;1
che todo bien con lluvia pero yo tengo hacer cosas ;1
adivina si lave auto ayer ahora llueve como puta madre ;1
fin semana con abundantes lluvias  recomiendan limpiar canaletas  rosario  ;0
un miedo tormenta ;1
de rayos gamma rayos  nuevo metodo permite descubrir emision pulsares previamente desconocida   ;0
mientras no llega lluvia  espera sabado caluroso ciudad  ;0
hasta cuando lluvia hermano  \U0001f611 \U0001f611 ;0
a aman verano     noviembre hacen    grados con lluvia  aguante frio caretas ;1
mates  estudio lluvia fondo \U0001f44c \u2614 \u2601 ;1
no queje corto luz porque noche nos regalo show rayos oscuras  digno ver estamos sentados reposera afuera casa   ;1
esa lluvia  \U0001f60d ;0
tormenta no podes esperar hasta vuelva peluqueria   ;1
que lindo llueve  no pare mas ahora  \U0001f602 ;1
como llueve lcdsm no anda nada ;1
lluvia mierda dejo sin luz mojo toda cama ;0
flashie habia parado lluvia fo ;1
